PubmedID,Title,Authors,Affiliations
40054034,"Pluripotent stem cell-derived mesenchymal stem cells for therapeutic applications, developmental study, and cancer research.","Siyi Fu, Cheung K Yeung, Ren-He Xu","Center of Reproduction, Development & Aging, and Institute of Translational Medicine, Faculty of Health Sciences, University of Macau, Taipa, Macau, China., Center of Reproduction, Development & Aging, and Institute of Translational Medicine, Faculty of Health Sciences, University of Macau, Taipa, Macau, China., Center of Reproduction, Development & Aging, and Institute of Translational Medicine, Faculty of Health Sciences, University of Macau, Taipa, Macau, China. Electronic address: renhexu@um.edu.mo."
40054028,Association between body composition parameters and treatment-related toxicities in patients with metastatic breast cancer receiving cyclin-dependent kinase 4 and 6 inhibitors.,"Giovanni Imbimbo, Marica Pellegrini, Simone Scagnoli, Simona Pisegna, Veronica Rizzo, Carmen Gallicchio, Andrea Botticelli, Alessio Molfino","Department of Translational and Precision Medicine, Sapienza University of Rome, Rome, Italy., Department of Translational and Precision Medicine, Sapienza University of Rome, Rome, Italy., Department of Radiological, Oncological and Pathological Sciences, Sapienza University of Rome, Rome, Italy., Department of Experimental Medicine, Sapienza University of Rome, Rome, Italy., Department of Radiological, Oncological and Pathological Sciences, Sapienza University of Rome, Rome, Italy., Department of Translational and Precision Medicine, Sapienza University of Rome, Rome, Italy., Department of Radiological, Oncological and Pathological Sciences, Sapienza University of Rome, Rome, Italy. Electronic address: andrea.botticelli@uniroma1.it., Department of Translational and Precision Medicine, Sapienza University of Rome, Rome, Italy. Electronic address: alessio.molfino@uniroma1.it."
40053906,Comparison of Short-Term Outcomes Between Robotic-Assisted and Open Pancreatoduodenectomy: A Retrospective Cohort Study With Inverse Probability of Treatment Weighting (IPTW) Analysis.,"Xi-Tai Huang, Jin-Zhao Xie, Jian-Peng Cai, Qiong-Cong Xu, Wei Chen, Chen-Song Huang, Bin Li, Jia-Ming Lai, Li-Jian Liang, Xiao-Yu Yin","Department of Pancreato-Biliary Surgery, The First Affiliated Hospital, Sun Yat-sen University, Guangzhou, China., Department of Pancreato-Biliary Surgery, The First Affiliated Hospital, Sun Yat-sen University, Guangzhou, China., Department of Pancreato-Biliary Surgery, The First Affiliated Hospital, Sun Yat-sen University, Guangzhou, China., Department of Pancreato-Biliary Surgery, The First Affiliated Hospital, Sun Yat-sen University, Guangzhou, China., Department of Pancreato-Biliary Surgery, The First Affiliated Hospital, Sun Yat-sen University, Guangzhou, China., Department of Pancreato-Biliary Surgery, The First Affiliated Hospital, Sun Yat-sen University, Guangzhou, China., Clinical Trials Unit, The First Affiliated Hospital, Sun Yat-sen University, Guangzhou, China., Department of Pancreato-Biliary Surgery, The First Affiliated Hospital, Sun Yat-sen University, Guangzhou, China., Department of Pancreato-Biliary Surgery, The First Affiliated Hospital, Sun Yat-sen University, Guangzhou, China., Department of Pancreato-Biliary Surgery, The First Affiliated Hospital, Sun Yat-sen University, Guangzhou, China."
40053904,System and Technology of Breast Intervention Robot: A Review.,"Haiyan Du, Zhongwen Wang, Yongde Zhang, Xun Huang, Xilei Wang","Key Laboratory of Advanced Manufacturing and Intelligent Technology, Harbin University of Science and Technology, Harbin, China., Key Laboratory of Advanced Manufacturing and Intelligent Technology, Harbin University of Science and Technology, Harbin, China., Key Laboratory of Advanced Manufacturing and Intelligent Technology, Harbin University of Science and Technology, Harbin, China., Key Laboratory of Advanced Manufacturing and Intelligent Technology, Harbin University of Science and Technology, Harbin, China., Key Laboratory of Advanced Manufacturing and Intelligent Technology, Harbin University of Science and Technology, Harbin, China."
40053902,Prospective Evaluation of the Pathologic Diagnosis and Treatment Outcomes of Pediatric Burkitt Lymphoma in the Central American Pediatric Hematology-Oncology Association Consortium.,"Priya Kumar, Monika L Metzger, John K Choi, Godwin Job, Teresa C Santiago, Armando Peña, Miguela A Caniza, Asya Agulnik, Pascale Y Gassant, Wendy C Gómez García, Patricia J Calderón, Claudia Garrido, Roy Rosado, Soad Fuentes Alabí, Valentino Conter, Meenakshi Devidas, Angela K Carrillo, Yichen Chen, Paola Friedrich, Carlos Rodriguez Galindo, Guillermo L Chantada, Victor M Santana","Department of Pathology, St Jude Children's Research Hospital, Memphis, TN., Department of Global Pediatric Medicine, St Jude Children's Research Hospital, Memphis, TN., Department of Pathology, St Jude Children's Research Hospital, Memphis, TN., Department of Global Pediatric Medicine, St Jude Children's Research Hospital, Memphis, TN., Department of Pathology, St Jude Children's Research Hospital, Memphis, TN., Pediatric Hematology/Oncology Service, Hospital Escuela Universitario, Tegucigalpa, Honduras., Department of Global Pediatric Medicine, St Jude Children's Research Hospital, Memphis, TN., Department of Global Pediatric Medicine, St Jude Children's Research Hospital, Memphis, TN., Department of Pediatric Oncology, Hospital Saint Damien, Port-au-Prince, Haiti., Department of Oncology, Hospital Infantil Dr Robert Reid Cabral, Santo Domingo, República Dominicana., Department of Pediatrics, Hematology/Oncology, Hospital Infantil Manuel de Jesus Rivera La Mascota, Managua, Nicaragua., Department of Pediatrics, Unidad de Oncologia Pediátrica, Francisco Marroquin University, School of Medicine, Guatemala City, Guatemala., Department of Pediatrics, Unidad de Oncologia Pediátrica, Francisco Marroquin University, School of Medicine, Guatemala City, Guatemala., Department of Pediatric Oncology, Hospital de Niños Benjamin Bloom, San Salvador, El Salvador., Pediatric Hemato-Oncology, Fondazione Tettamanti, IRCCS San Gerardo, Monza, Italy., Department of Global Pediatric Medicine, St Jude Children's Research Hospital, Memphis, TN., Department of Global Pediatric Medicine, St Jude Children's Research Hospital, Memphis, TN., Department of Global Pediatric Medicine, St Jude Children's Research Hospital, Memphis, TN., Department of Global Pediatric Medicine, St Jude Children's Research Hospital, Memphis, TN., Department of Global Pediatric Medicine, St Jude Children's Research Hospital, Memphis, TN., Department of Hematology/Oncology, Institut de Recerca Sant Joan de Deu; Pediatric Cancer Center Barcelona, Hospital Sant Joan de Deu, Barcelona, Spain., Department of Global Pediatric Medicine, St Jude Children's Research Hospital, Memphis, TN."
